{
  "tag": "MONDAY",
  "quote_en": "You don't need perfect English. You need ==brave== English.",
  "quote_tr": "Mükemmel İngilizce değil, cesur İngilizce lazım.",
  "author": "Ahsan · AHK Akademi",
  "meta": {
    "topic": "motivation: brave English",
    "caption": "Mükemmel İngilizce değil, cesur İngilizce lazım 💪\n\nHata yapmaktan korktuğun için susuyorsan, ilerlemiyorsun. Her yanlış cümle, bir sonraki doğru cümlenin provası.\n\nBu hafta İngilizce konuşacağın 1 ortam seç ve yorumlara yaz 👇\nKaydet, moralin düştüğünde aç 🔖\n\nYou don't need perfect English. You need brave English.",
    "hashtags": ["#motivasyon", "#ingilizce", "#ahkakademi", "#learnenglish", "#ingilizceöğreniyorum", "#speakenglish", "#motivation", "#ielts", "#englishlearning", "#pazartesi", "#cesaret"],
    "audio_mood": "n/a (static post)"
  }
}
